{
  "schemaVersion": "1.0.0",
  "metricVersion": "calibration-mutation-metrics/1.0.0",
  "id": "efforthours-public-synthetic-mutations",
  "version": "0.1.0",
  "description": "Synthetic .NET mutation guardrails for invariance, directionality, and category isolation.",
  "cases": [
    {
      "id": "dotnet-base",
      "description": "Minimal maintained .NET library used as the reference case.",
      "sourceDigest": "sha256:125e0d7acdddc9e5ed948a7dcb0a56745135a91626c0deacaf6bdc813334b1c5",
      "profile": "implementation",
      "baselineId": "senior-contractor-2026-no-ai"
    },
    {
      "id": "dotnet-formatting",
      "description": "The maintained behavior is reformatted without semantic changes.",
      "sourceDigest": "sha256:ddae2b4f235b05ecaa0d3ef8a9926f65163f4d1314f0e7ee61a72474d4a4c305",
      "profile": "implementation",
      "baselineId": "senior-contractor-2026-no-ai"
    },
    {
      "id": "dotnet-duplicate",
      "description": "An exact source copy excluded from compilation is added.",
      "sourceDigest": "sha256:4bacee4a98cb4e4d5e2ef54ab5ab919c7d07921558656af5b0a37598b4608884",
      "profile": "implementation",
      "baselineId": "senior-contractor-2026-no-ai"
    },
    {
      "id": "dotnet-generated",
      "description": "A conventional generated source body is added.",
      "sourceDigest": "sha256:cedc7fef102c809f46a14d305b336ef4495db89550d6b40a4280746efee9d6da",
      "profile": "implementation",
      "baselineId": "senior-contractor-2026-no-ai"
    },
    {
      "id": "dotnet-api",
      "description": "A runnable HTTP status endpoint is added.",
      "sourceDigest": "sha256:7cea0cbeeca5776eccefaf97453ff652bca782cbc28a77505b5feb8e730944ed",
      "profile": "implementation",
      "baselineId": "senior-contractor-2026-no-ai"
    },
    {
      "id": "dotnet-tests",
      "description": "A unit-test project and two behavioral tests are added.",
      "sourceDigest": "sha256:3be273ba7e9b0b35d722cbb54db68a3782a82fa8358bd8de14ece3d2e4edd946",
      "profile": "implementation",
      "baselineId": "senior-contractor-2026-no-ai"
    },
    {
      "id": "dotnet-documentation",
      "description": "Maintained onboarding and usage documentation is added.",
      "sourceDigest": "sha256:06094258a7709e6879b0189e67d9109bca4dd1b25399e7a1416753987e259a32",
      "profile": "implementation",
      "baselineId": "senior-contractor-2026-no-ai"
    },
    {
      "id": "dotnet-integration",
      "description": "A maintained external HTTP integration boundary is added.",
      "sourceDigest": "sha256:b5ac5c0c74a150c8ca645c65e369c359a60a4a725e6b58d1f70344873c371178",
      "profile": "implementation",
      "baselineId": "senior-contractor-2026-no-ai"
    }
  ],
  "assertions": [
    {
      "id": "dotnet-formatting-total-invariant",
      "family": "formatting-only",
      "subjectCaseId": "dotnet-formatting",
      "referenceCaseId": "dotnet-base",
      "point": "expected",
      "scope": "repository-total",
      "minimumDifferenceHours": 0,
      "maximumDifferenceHours": 0,
      "rationale": "Formatting alone must not change represented EHE."
    },
    {
      "id": "dotnet-formatting-production-invariant",
      "family": "formatting-only",
      "subjectCaseId": "dotnet-formatting",
      "referenceCaseId": "dotnet-base",
      "point": "expected",
      "scope": "category",
      "category": "production-implementation",
      "minimumDifferenceHours": 0,
      "maximumDifferenceHours": 0,
      "rationale": "Formatting alone must not change production effort."
    },
    {
      "id": "dotnet-duplicate-total-invariant",
      "family": "exact-duplication",
      "subjectCaseId": "dotnet-duplicate",
      "referenceCaseId": "dotnet-base",
      "point": "expected",
      "scope": "repository-total",
      "minimumDifferenceHours": 0,
      "maximumDifferenceHours": 0,
      "rationale": "An excluded exact source copy must not increase represented EHE."
    },
    {
      "id": "dotnet-duplicate-production-invariant",
      "family": "exact-duplication",
      "subjectCaseId": "dotnet-duplicate",
      "referenceCaseId": "dotnet-base",
      "point": "expected",
      "scope": "category",
      "category": "production-implementation",
      "minimumDifferenceHours": 0,
      "maximumDifferenceHours": 0,
      "rationale": "Exact duplicate implementation volume must be normalized."
    },
    {
      "id": "dotnet-generated-total-invariant",
      "family": "generated-content",
      "subjectCaseId": "dotnet-generated",
      "referenceCaseId": "dotnet-base",
      "point": "expected",
      "scope": "repository-total",
      "minimumDifferenceHours": 0,
      "maximumDifferenceHours": 0,
      "rationale": "A conventional generated body must not increase represented EHE."
    },
    {
      "id": "dotnet-generated-production-invariant",
      "family": "generated-content",
      "subjectCaseId": "dotnet-generated",
      "referenceCaseId": "dotnet-base",
      "point": "expected",
      "scope": "category",
      "category": "production-implementation",
      "minimumDifferenceHours": 0,
      "maximumDifferenceHours": 0,
      "rationale": "Generated implementation volume must remain excluded from production effort."
    },
    {
      "id": "dotnet-api-total-increases",
      "family": "meaningful-api-behavior",
      "subjectCaseId": "dotnet-api",
      "referenceCaseId": "dotnet-base",
      "point": "expected",
      "scope": "repository-total",
      "minimumDifferenceHours": 0.5,
      "rationale": "A runnable HTTP boundary must increase total represented effort."
    },
    {
      "id": "dotnet-api-production-increases",
      "family": "meaningful-api-behavior",
      "subjectCaseId": "dotnet-api",
      "referenceCaseId": "dotnet-base",
      "point": "expected",
      "scope": "category",
      "category": "production-implementation",
      "minimumDifferenceHours": 0.5,
      "rationale": "HTTP behavior must increase production implementation effort."
    },
    {
      "id": "dotnet-tests-unit-testing-increases",
      "family": "represented-tests",
      "subjectCaseId": "dotnet-tests",
      "referenceCaseId": "dotnet-base",
      "point": "expected",
      "scope": "category",
      "category": "unit-testing",
      "minimumDifferenceHours": 0.5,
      "rationale": "Maintained unit tests must add represented unit-testing effort."
    },
    {
      "id": "dotnet-tests-production-isolated",
      "family": "represented-tests",
      "subjectCaseId": "dotnet-tests",
      "referenceCaseId": "dotnet-base",
      "point": "expected",
      "scope": "category",
      "category": "production-implementation",
      "minimumDifferenceHours": 0,
      "maximumDifferenceHours": 0,
      "rationale": "A test-only addition must not inflate production implementation."
    },
    {
      "id": "dotnet-documentation-increases",
      "family": "represented-documentation",
      "subjectCaseId": "dotnet-documentation",
      "referenceCaseId": "dotnet-base",
      "point": "expected",
      "scope": "category",
      "category": "documentation",
      "minimumDifferenceHours": 0.5,
      "rationale": "Maintained onboarding and usage guidance must add documentation effort."
    },
    {
      "id": "dotnet-documentation-production-isolated",
      "family": "represented-documentation",
      "subjectCaseId": "dotnet-documentation",
      "referenceCaseId": "dotnet-base",
      "point": "expected",
      "scope": "category",
      "category": "production-implementation",
      "minimumDifferenceHours": 0,
      "maximumDifferenceHours": 0,
      "rationale": "A documentation-only addition must not inflate production implementation."
    },
    {
      "id": "dotnet-integration-total-increases",
      "family": "external-integration",
      "subjectCaseId": "dotnet-integration",
      "referenceCaseId": "dotnet-base",
      "point": "expected",
      "scope": "repository-total",
      "minimumDifferenceHours": 0.5,
      "rationale": "A maintained external client boundary must increase total represented effort."
    },
    {
      "id": "dotnet-integration-category-increases",
      "family": "external-integration",
      "subjectCaseId": "dotnet-integration",
      "referenceCaseId": "dotnet-base",
      "point": "expected",
      "scope": "category",
      "category": "external-integrations-and-protocols",
      "minimumDifferenceHours": 0.5,
      "rationale": "The external-integration category must receive the integration work."
    }
  ]
}
